{"schema_version":"2.0","meta":{"title":"示例路书","destination":"示例城","language":"zh-CN","start_date":"2026-10-01","days":1,"theme":"lake-city"},"trip":{"primary_mode":"city","secondary_modes":[]},"privacy":{"output_scope":"personal","private_paths":[],"sensitive_fields":[]},"personalization":{"pace":"relaxed","signals":[],"applied_rules":[]},"sources":[],"days":[{"day":1,"date":"2026-10-01","title":"慢游","rest_windows":["14:00-15:00"],"rain_alternatives":["城市博物馆"],"items":[{"name":"湖滨公园","start":"09:00","end":"11:00","coords":[120.1,30.2]}]}]}
